{
  "name": "sync-docs",
  "version": "1.0.0-alpha.1",
  "description": "Sync documentation with code changes. Find outdated refs, update CHANGELOG, flag stale examples.",
  "author": {
    "name": "Avi Fenesh",
    "email": "[email protected]",
    "url": "https://github.com/avifenesh"
  },
  "homepage": "https://github.com/avifenesh/awesome-slash#sync-docs",
  "repository": "https://github.com/avifenesh/awesome-slash",
  "license": "MIT",
  "keywords": [
    "documentation",
    "changelog",
    "sync",
    "maintenance",
    "code-docs"
  ]
}
